{
  "$schema": "./agent-setup.schema.json",
  "deployment": {
    "workerName": "sub-store-cloudflare",
    "d1DatabaseName": "sub-store-cloudflare",
    "adminHostname": "substore.example.com",
    "downloadHostname": "sub.example.com",
    "downloadTargets": ["mihomo", "stash", "surge", "surge-mac", "surfboard", "loon", "egern", "shadowrocket", "qx", "sing-box", "v2ray", "uri", "json"]
  },
  "access": {
    "enabled": true,
    "scope": "account",
    "accountId": "00000000000000000000000000000000",
    "zoneId": "",
    "adminHostname": "substore.example.com",
    "allowedEmails": ["you@example.com"],
    "allowedEmailDomains": [],
    "sessionDuration": "24h"
  },
  "sources": [
    {
      "id": "airport-a",
      "name": "Airport A",
      "type": "remote",
      "url": "https://example.com/subscription",
      "enabled": true,
      "filterPresetIds": ["clean-provider-nodes"],
      "filters": [],
      "meta": {
        "tag": ["airport"]
      }
    }
  ],
  "collections": [
    {
      "id": "daily",
      "name": "Daily",
      "sourceIds": ["airport-a"],
      "templateId": "acl4ssr-mihomo",
      "ignoreFailed": true,
      "filterPresetIds": ["dedupe-by-endpoint", "sort-by-name"],
      "filters": [],
      "meta": {
        "tag": ["default"]
      }
    }
  ],
  "templates": []
}
